id,category,solutions
1,Psychological Factors,"Manage Pressure and Anxiety: Practice mindfulness techniques like deep breathing, visualization, and meditation to stay calm and focused during high-pressure moments."
2,Psychological Factors,Build Confidence: Use positive affirmations and focus on past successes to boost self-belief before taking a penalty.
3,Psychological Factors,Avoid Overthinking: Stick to a pre-decided plan for the shot and commit to it without second-guessing.
4,Psychological Factors,"Address Personal Distractions: Speak to a mentor, coach, or counselor to resolve any personal or family issues that may be affecting focus."
5,Psychological Factors,Simulate High-Pressure Situations: Practice penalty kicks with teammates creating realistic crowd noise and pressure to build mental resilience.
6,Psychological Factors,Learn from Misses: Analyze past penalties to identify what went wrong and create a structured improvement plan.
7,Psychological Factors,Set Realistic Expectations: Remember that missing a penalty is part of the game and avoid putting excessive pressure on yourself to perform flawlessly.
8,Physical Factors,Ensure Full Recovery: Avoid rushing back from injuries. Work closely with a physiotherapist to regain full strength and mobility.
9,Physical Factors,Improve Fitness Levels: Incorporate lower-body strength training and flexibility exercises into regular workouts to improve shot power and control.
10,Physical Factors,Warm Up Properly: Perform dynamic stretches and muscle activation drills before games to prevent stiffness.
11,Physical Factors,Stay Hydrated: Maintain optimal hydration levels to avoid fatigue and maintain focus.
12,Physical Factors,Avoid Overtraining: Balance intense training sessions with sufficient rest to avoid burnout and maintain peak performance.
13,Physical Factors,Address Muscle Imbalances: Work on bilateral strength exercises to ensure both legs are equally strong and stable.
14,Physical Factors,Practice Under Fatigue: Simulate game fatigue during practice sessions to prepare for taking penalties late in matches.
15,Technical Factors,"Refine Technique: Focus on proper planting foot alignment, body posture, and follow-through when practicing penalties."
16,Technical Factors,Control Leaning: Practice striking the ball with proper body alignment to avoid leaning too far back or forward.
17,Technical Factors,Perfect Ball Contact: Learn to hit the ball on the sweet spot for better accuracy and power.
18,Technical Factors,"Practice Spin Control: Develop skills to apply controlled spin on the ball, depending on the desired trajectory."
19,Technical Factors,Vary Penalty Placement: Avoid being predictable by practicing shots aimed at different areas of the goal.
20,Technical Factors,"Develop a Routine: Create a consistent pre-kick routine (e.g., taking the same number of steps or breaths) to maintain focus."
21,Technical Factors,Simulate Goalkeeper Movements: Practice penalties with goalkeepers intentionally diving to improve decision-making.
22,Environmental Factors,"Adapt to Weather Conditions: Practice in various weather conditions to learn how to adjust shots for wind, rain, or cold."
23,Environmental Factors,Wear Proper Gear: Use appropriate cleats for the field surface to avoid slipping or losing balance.
24,Environmental Factors,Inspect the Field: Identify any uneven or problematic spots on the penalty area before taking the kick.
25,Environmental Factors,Manage Crowds: Practice blocking out crowd noise by staying focused on your technique and routine.
26,Environmental Factors,"Acclimate to New Venues: Arrive early to get a feel for the field, lighting, and environment of unfamiliar stadiums."
27,Environmental Factors,Shield from Sunlight: Wear a cap or use hand gestures to block sunlight when preparing for a kick.
28,Environmental Factors,Prepare for Distractions: Practice with teammates intentionally trying to distract you to build focus and composure.
29,External Factors,Seek Professional Support: Work with a sports psychologist to develop strategies for handling personal and external stress.
30,External Factors,Communicate with Coaches: Let coaches know if you?re not mentally or physically ready to take a penalty.
31,External Factors,Build Team Unity: Engage in team-building activities to improve morale and reduce internal conflicts.
32,External Factors,Prepare for Media Pressure: Practice responding to media questions and criticism to build resilience.
33,External Factors,Address Financial Worries: Seek support from financial advisors or sponsors to reduce off-field stress.
34,External Factors,Focus on Controllables: Accept that external factors like socio-political issues are beyond control and focus on what you can impact.
35,External Factors,Mentally Reframe Mistakes: View missed penalties as learning opportunities rather than failures.
36,General Improvements,"Study Goalkeepers: Analyze the movements, tendencies, and diving patterns of goalkeepers you are likely to face."
37,General Improvements,"Commit to the Shot: Once you decide on a shot placement, avoid hesitation and execute with full confidence."
38,General Improvements,Develop Versatility: Learn to take penalties with both feet to expand your options and surprise goalkeepers.
39,General Improvements,Work on Mental Clarity: Use visualization to imagine yourself successfully scoring in high-pressure situations.
40,General Improvements,Celebrate Successes: Reward yourself for improvements in practice and matches to stay motivated.
41,General Improvements,"Stay Physically Fit: Incorporate a well-rounded fitness routine with strength, endurance, and agility training."
42,General Improvements,Take Feedback Positively: Listen to constructive criticism from coaches and teammates to improve.
43,General Improvements,"Adjust for Fatigue: In games, factor in your physical condition and aim for simpler, more reliable shots."
44,General Improvements,Practice Spot Inspection: Quickly check the ball placement and ground stability before striking.
45,General Improvements,"Rehearse Rapid Decisions: Train to make quick, confident decisions about shot placement even under unpredictable circumstances."
46,Long-Term Strategies,Emphasize Consistency: Develop a penalty-taking routine you can rely on in any situation.
47,Long-Term Strategies,Strengthen Core Muscles: A strong core improves balance and stability during the penalty kick.
48,Long-Term Strategies,Review Video Footage: Regularly analyze video footage of your penalty kicks to identify and correct mistakes.
49,Long-Term Strategies,Practice Under Pressure: Simulate competition scenarios with time constraints or mock tournaments.
50,Long-Term Strategies,"Set Incremental Goals: Focus on small, achievable targets to improve specific aspects of your penalty-taking skill."
